word	other_form	surface_form	direction	freq	pmi	example_sentence
saada	jäädä	saa jäädä	R	2626	1.2659	Totta kai hän saa jäädä .
saada	jäädä	saa jäädä	R	2626	1.2659	Emme saa jäädä loukkuun tänne .
saada	jäädä	saa jäädä	R	2626	1.2659	Ei saa jäädä yksin .
saada	jäädä	saa jäädä	R	2626	1.2659	Tyttö tulee kaveri saa jäädä
saada	jäädä	saa jäädä	R	2626	1.2659	Et saa jäädä .
saada	jäädä	saa jäädä	R	2626	1.2659	Et saa jäädä kiinni elävänä .
saada	jäädä	saa jäädä	R	2626	1.2659	Creb saa jäädä .
saada	jäädä	saa jäädä	R	2626	1.2659	Rohkeutesi ei saa jäädä palkkiotta .
saada	jäädä	saa jäädä	R	2626	1.2659	Emme saa jäädä loukkuun !
saada	jäädä	saa jäädä	R	2626	1.2659	Pöksyihin ei saa jäädä tahroja .
saada	jäädä	saa jäädä	R	2626	1.2659	panther ei saa jäädä kiinni .
saada	jäädä	saa jäädä	R	2626	1.2659	Yksikkösi saa jäädä , sinun juhlasi on juhlittu .
saada	jäädä	saa jäädä	R	2626	1.2659	Driscoll , kaksi miestä saa jäädä vahtimaan veneitä .
saada	jäädä	saa jäädä	R	2626	1.2659	Hän saa jäädä vieraaksemme .
saada	jäädä	saa jäädä	R	2626	1.2659	Todistajia ei saa jäädä .
saada	jäädä	saa jäädä	R	2626	1.2659	Enkö saa jäädä kotiin , lupaan olla kiltti ?
saada	jäädä	saa jäädä	R	2626	1.2659	tämäkin saa jäädä .
saada	jäädä	saa jäädä	R	2626	1.2659	Hän saa jäädä .
saada	jäädä	saa jäädä	R	2626	1.2659	Mitään jälkiä ei saa jäädä .
saada	kuinka	kuinka sait	L	2559	1.0403	Kuinka sait käännytettyä heidät ?
saada	kuinka	kuinka sait	L	2559	1.0403	Kuinka sait käännytettyä heidät puolellesi ?
saada	kuinka	kuinka sait	L	2559	1.0403	Kuinka sait Drive Byn tulemaan tänne ?
saada	kuinka	kuinka sait	L	2559	1.0403	Kuinka sait ... avaimen ?
saada	kuinka	kuinka sait	L	2559	1.0403	Kuinka sait kopiot ?
saada	kuinka	kuinka sait	L	2559	1.0403	Kuinka sait hänet ?
saada	kuinka	kuinka sait	L	2559	1.0403	Kuinka sait minut puhuttua tähän ?
saada	kuinka	kuinka sait	L	2559	1.0403	Kuinka sait sen käsiisi ?
saada	kuinka	kuinka sait	L	2559	1.0403	Kuinka sait filmin mahtumaan ?
saada	kuinka	kuinka sait	L	2559	1.0403	Kuinka sait hänet tänne ?
saada	kuinka	kuinka sait	L	2559	1.0403	Kuinka sait sen ?
saada	kuinka	kuinka sait	L	2559	1.0403	Kuinka sait tuollaisen nimen ?
saada	kuinka	kuinka sait	L	2559	1.0403	Kuinka sait ne ?
saada	kuinka	kuinka sait	L	2559	1.0403	Kuinka sait DNA: t sopimaan toisiinsa ?
saada	kuinka	kuinka sait	L	2559	1.0403	Kuinka sait tämän numeron ?
saada	kuinka	kuinka sait	L	2559	1.0403	Kuinka sait ensimmäiseksi tietää masturboinnista ?
saada	kuinka	kuinka sait	L	2559	1.0403	Kuinka sait sähköpostiosoitteeni ?
saada	kuinka	kuinka sait	L	2559	1.0403	Kuinka sait osoitteeni ?
saada	kuinka	kuinka sait	L	2559	1.0403	Kuinka sait roolin ?
saada	kuinka	kuinka sait	L	2559	1.0403	Kuinka sait sen selville ?
saada	vastaus	saanut vastausta	R	2437	2.7026	En ole saanut vastausta yhteenkään kirjeeseeni
saada	vastaus	saanut vastausta	R	2437	2.7026	ei ole saanut vastausta vuoteen , se pitäisi tietää jo .
saada	vastaus	saanut vastausta	R	2437	2.7026	Soitin hotelliisi , en saanut vastausta .
saada	vastaus	saanut vastausta	R	2437	2.7026	Olen yrittänyt tavoittaa sitä , en ole saanut vastausta .
saada	vastaus	saanut vastausta	R	2437	2.7026	En saanut vastausta .
saada	vastaus	saanut vastausta	R	2437	2.7026	Minulla on muutama kysymys , joihin en ole saanut vastausta .
saada	vastaus	saanut vastausta	R	2437	2.7026	Olen lähettänyt monta kirjettä , en ole saanut vastausta .
saada	vastaus	saanut vastausta	R	2437	2.7026	en saanut vastausta , olin häpeissäni .
saada	vastaus	saanut vastausta	R	2437	2.7026	Yritin soittaa kotiisi kännykkääsi , mutten saanut vastausta .
saada	vastaus	saanut vastausta	R	2437	2.7026	Olen kysynyt lähteeltämme , millä taajuudella häirintä on heikointa , tähän mennessä en ole saanut vastausta .
saada	vastaus	saanut vastausta	R	2437	2.7026	En ole saanut vastausta .
saada	vastaus	saanut vastausta	R	2437	2.7026	Pahoitteluni , soitin toimistoosi , en saanut vastausta , enkä todellakaan tiedä mitä tekisin .
saada	vastaus	saanut vastausta	R	2437	2.7026	Kirjoitin soitin heille , en saanut vastausta .
saada	vastaus	saanut vastausta	R	2437	2.7026	niin Norton oli sanonut , Andy ei saanut vastausta .
saada	vastaus	saanut vastausta	R	2437	2.7026	Kutsuin tätiäsi , mutten saanut vastausta .
saada	vastaus	saanut vastausta	R	2437	2.7026	Yritin muutaman kerran , en saanut vastausta .
saada	vastaus	saanut vastausta	R	2437	2.7026	Vastasin viimeisimpään sähköpostiisi , en saanut vastausta .
saada	vastaus	saanut vastausta	R	2437	2.7026	pyysin apua kaivamisessa en saanut vastausta me kaikki autamme kaivamisessa poistaisimme täältä kaiken hiilen eikä alla olisi mitään
saada	vastaus	saanut vastausta	R	2437	2.7026	En saanut vastausta kysymykseeni .
saada	vastaus	saanut vastausta	R	2437	2.7026	Ikinä ei saanut vastausta .
